,,3,A,,,¡Dios Santo! ¿Qué diablos es eso?,Jesus Christ! What the hell is that?
,,1,C,,,"¿Qué pasa, Miller? ¿Qué estás viendo?","What is it, Miller? What are you seeing?"
,,3,A,,,Es la flor más fea que he visto en mi vida.,That's the ugliest flower I've ever seen in my life.
,,2,C,,,"Jerry, eres imbécil.","Jerry, you're a moron."
,,3,A,,,Seguro que está mustia por lo deforme que es.,I'm sure it's withered because it's so misshapen.
0,,3,A,,,"Perdón, continúo explorando.","Sorry, I'll keep exploring."